[
  {
    "id": "TR-Y-34-017-M-0001",
    "level": "yerlesim",
    "type": "mahalle",
    "parent_id": "TR-D-34-017",
    "province_id": "TR-P-34",
    "district_id": "TR-D-34-017",
    "province_name": "İstanbul",
    "district_name": "Esenler",
    "name": "15 Temmuz",
    "name_ascii": "15 temmuz",
    "slug": "15-temmuz-mahalle-esenler-istanbul-0001",
    "source": "e-icisleri-mulki-idare-bolumleri",
    "source_file": "Mahalle_Listesi.xls",
    "source_row": 14373
  },
  {
    "id": "TR-Y-34-017-M-0002",
    "level": "yerlesim",
    "type": "mahalle",
    "parent_id": "TR-D-34-017",
    "province_id": "TR-P-34",
    "district_id": "TR-D-34-017",
    "province_name": "İstanbul",
    "district_name": "Esenler",
    "name": "Atışalanı",
    "name_ascii": "atisalani",
    "slug": "atisalani-mahalle-esenler-istanbul-0002",
    "source": "e-icisleri-mulki-idare-bolumleri",
    "source_file": "Mahalle_Listesi.xls",
    "source_row": 14379
  },
  {
    "id": "TR-Y-34-017-M-0003",
    "level": "yerlesim",
    "type": "mahalle",
    "parent_id": "TR-D-34-017",
    "province_id": "TR-P-34",
    "district_id": "TR-D-34-017",
    "province_name": "İstanbul",
    "district_name": "Esenler",
    "name": "Birlik",
    "name_ascii": "birlik",
    "slug": "birlik-mahalle-esenler-istanbul-0003",
    "source": "e-icisleri-mulki-idare-bolumleri",
    "source_file": "Mahalle_Listesi.xls",
    "source_row": 14374
  },
  {
    "id": "TR-Y-34-017-M-0004",
    "level": "yerlesim",
    "type": "mahalle",
    "parent_id": "TR-D-34-017",
    "province_id": "TR-P-34",
    "district_id": "TR-D-34-017",
    "province_name": "İstanbul",
    "district_name": "Esenler",
    "name": "Çifte Havuzlar",
    "name_ascii": "cifte havuzlar",
    "slug": "cifte-havuzlar-mahalle-esenler-istanbul-0004",
    "source": "e-icisleri-mulki-idare-bolumleri",
    "source_file": "Mahalle_Listesi.xls",
    "source_row": 14375
  },
  {
    "id": "TR-Y-34-017-M-0005",
    "level": "yerlesim",
    "type": "mahalle",
    "parent_id": "TR-D-34-017",
    "province_id": "TR-P-34",
    "district_id": "TR-D-34-017",
    "province_name": "İstanbul",
    "district_name": "Esenler",
    "name": "Davutpaşa",
    "name_ascii": "davutpasa",
    "slug": "davutpasa-mahalle-esenler-istanbul-0005",
    "source": "e-icisleri-mulki-idare-bolumleri",
    "source_file": "Mahalle_Listesi.xls",
    "source_row": 14376
  },
  {
    "id": "TR-Y-34-017-M-0006",
    "level": "yerlesim",
    "type": "mahalle",
    "parent_id": "TR-D-34-017",
    "province_id": "TR-P-34",
    "district_id": "TR-D-34-017",
    "province_name": "İstanbul",
    "district_name": "Esenler",
    "name": "Fatih",
    "name_ascii": "fatih",
    "slug": "fatih-mahalle-esenler-istanbul-0006",
    "source": "e-icisleri-mulki-idare-bolumleri",
    "source_file": "Mahalle_Listesi.xls",
    "source_row": 14377
  },
  {
    "id": "TR-Y-34-017-M-0007",
    "level": "yerlesim",
    "type": "mahalle",
    "parent_id": "TR-D-34-017",
    "province_id": "TR-P-34",
    "district_id": "TR-D-34-017",
    "province_name": "İstanbul",
    "district_name": "Esenler",
    "name": "Fevzi Çakmak",
    "name_ascii": "fevzi cakmak",
    "slug": "fevzi-cakmak-mahalle-esenler-istanbul-0007",
    "source": "e-icisleri-mulki-idare-bolumleri",
    "source_file": "Mahalle_Listesi.xls",
    "source_row": 14378
  },
  {
    "id": "TR-Y-34-017-M-0008",
    "level": "yerlesim",
    "type": "mahalle",
    "parent_id": "TR-D-34-017",
    "province_id": "TR-P-34",
    "district_id": "TR-D-34-017",
    "province_name": "İstanbul",
    "district_name": "Esenler",
    "name": "Kazım Karabekir",
    "name_ascii": "kazim karabekir",
    "slug": "kazim-karabekir-mahalle-esenler-istanbul-0008",
    "source": "e-icisleri-mulki-idare-bolumleri",
    "source_file": "Mahalle_Listesi.xls",
    "source_row": 14380
  },
  {
    "id": "TR-Y-34-017-M-0009",
    "level": "yerlesim",
    "type": "mahalle",
    "parent_id": "TR-D-34-017",
    "province_id": "TR-P-34",
    "district_id": "TR-D-34-017",
    "province_name": "İstanbul",
    "district_name": "Esenler",
    "name": "Kemer",
    "name_ascii": "kemer",
    "slug": "kemer-mahalle-esenler-istanbul-0009",
    "source": "e-icisleri-mulki-idare-bolumleri",
    "source_file": "Mahalle_Listesi.xls",
    "source_row": 14381
  },
  {
    "id": "TR-Y-34-017-M-0010",
    "level": "yerlesim",
    "type": "mahalle",
    "parent_id": "TR-D-34-017",
    "province_id": "TR-P-34",
    "district_id": "TR-D-34-017",
    "province_name": "İstanbul",
    "district_name": "Esenler",
    "name": "Menderes",
    "name_ascii": "menderes",
    "slug": "menderes-mahalle-esenler-istanbul-0010",
    "source": "e-icisleri-mulki-idare-bolumleri",
    "source_file": "Mahalle_Listesi.xls",
    "source_row": 14382
  },
  {
    "id": "TR-Y-34-017-M-0011",
    "level": "yerlesim",
    "type": "mahalle",
    "parent_id": "TR-D-34-017",
    "province_id": "TR-P-34",
    "district_id": "TR-D-34-017",
    "province_name": "İstanbul",
    "district_name": "Esenler",
    "name": "Mimar Sinan",
    "name_ascii": "mimar sinan",
    "slug": "mimar-sinan-mahalle-esenler-istanbul-0011",
    "source": "e-icisleri-mulki-idare-bolumleri",
    "source_file": "Mahalle_Listesi.xls",
    "source_row": 14383
  },
  {
    "id": "TR-Y-34-017-M-0012",
    "level": "yerlesim",
    "type": "mahalle",
    "parent_id": "TR-D-34-017",
    "province_id": "TR-P-34",
    "district_id": "TR-D-34-017",
    "province_name": "İstanbul",
    "district_name": "Esenler",
    "name": "Namık Kemal",
    "name_ascii": "namik kemal",
    "slug": "namik-kemal-mahalle-esenler-istanbul-0012",
    "source": "e-icisleri-mulki-idare-bolumleri",
    "source_file": "Mahalle_Listesi.xls",
    "source_row": 14384
  },
  {
    "id": "TR-Y-34-017-M-0013",
    "level": "yerlesim",
    "type": "mahalle",
    "parent_id": "TR-D-34-017",
    "province_id": "TR-P-34",
    "district_id": "TR-D-34-017",
    "province_name": "İstanbul",
    "district_name": "Esenler",
    "name": "Nine Hatun",
    "name_ascii": "nine hatun",
    "slug": "nine-hatun-mahalle-esenler-istanbul-0013",
    "source": "e-icisleri-mulki-idare-bolumleri",
    "source_file": "Mahalle_Listesi.xls",
    "source_row": 14385
  },
  {
    "id": "TR-Y-34-017-M-0014",
    "level": "yerlesim",
    "type": "mahalle",
    "parent_id": "TR-D-34-017",
    "province_id": "TR-P-34",
    "district_id": "TR-D-34-017",
    "province_name": "İstanbul",
    "district_name": "Esenler",
    "name": "Oruçreis",
    "name_ascii": "orucreis",
    "slug": "orucreis-mahalle-esenler-istanbul-0014",
    "source": "e-icisleri-mulki-idare-bolumleri",
    "source_file": "Mahalle_Listesi.xls",
    "source_row": 14386
  },
  {
    "id": "TR-Y-34-017-M-0015",
    "level": "yerlesim",
    "type": "mahalle",
    "parent_id": "TR-D-34-017",
    "province_id": "TR-P-34",
    "district_id": "TR-D-34-017",
    "province_name": "İstanbul",
    "district_name": "Esenler",
    "name": "Şehitler",
    "name_ascii": "sehitler",
    "slug": "sehitler-mahalle-esenler-istanbul-0015",
    "source": "e-icisleri-mulki-idare-bolumleri",
    "source_file": "Mahalle_Listesi.xls",
    "source_row": 14370
  },
  {
    "id": "TR-Y-34-017-M-0016",
    "level": "yerlesim",
    "type": "mahalle",
    "parent_id": "TR-D-34-017",
    "province_id": "TR-P-34",
    "district_id": "TR-D-34-017",
    "province_name": "İstanbul",
    "district_name": "Esenler",
    "name": "Tuna",
    "name_ascii": "tuna",
    "slug": "tuna-mahalle-esenler-istanbul-0016",
    "source": "e-icisleri-mulki-idare-bolumleri",
    "source_file": "Mahalle_Listesi.xls",
    "source_row": 14372
  },
  {
    "id": "TR-Y-34-017-M-0017",
    "level": "yerlesim",
    "type": "mahalle",
    "parent_id": "TR-D-34-017",
    "province_id": "TR-P-34",
    "district_id": "TR-D-34-017",
    "province_name": "İstanbul",
    "district_name": "Esenler",
    "name": "Turgut Reis",
    "name_ascii": "turgut reis",
    "slug": "turgut-reis-mahalle-esenler-istanbul-0017",
    "source": "e-icisleri-mulki-idare-bolumleri",
    "source_file": "Mahalle_Listesi.xls",
    "source_row": 14387
  },
  {
    "id": "TR-Y-34-017-M-0018",
    "level": "yerlesim",
    "type": "mahalle",
    "parent_id": "TR-D-34-017",
    "province_id": "TR-P-34",
    "district_id": "TR-D-34-017",
    "province_name": "İstanbul",
    "district_name": "Esenler",
    "name": "Yavuz Selim",
    "name_ascii": "yavuz selim",
    "slug": "yavuz-selim-mahalle-esenler-istanbul-0018",
    "source": "e-icisleri-mulki-idare-bolumleri",
    "source_file": "Mahalle_Listesi.xls",
    "source_row": 14388
  },
  {
    "id": "TR-Y-34-017-M-0019",
    "level": "yerlesim",
    "type": "mahalle",
    "parent_id": "TR-D-34-017",
    "province_id": "TR-P-34",
    "district_id": "TR-D-34-017",
    "province_name": "İstanbul",
    "district_name": "Esenler",
    "name": "Yeşil Vadi",
    "name_ascii": "yesil vadi",
    "slug": "yesil-vadi-mahalle-esenler-istanbul-0019",
    "source": "e-icisleri-mulki-idare-bolumleri",
    "source_file": "Mahalle_Listesi.xls",
    "source_row": 14371
  }
]
