[
  {
    "id": "TR-Y-61-010-M-0001",
    "level": "yerlesim",
    "type": "mahalle",
    "parent_id": "TR-D-61-010",
    "province_id": "TR-P-61",
    "district_id": "TR-D-61-010",
    "province_name": "Trabzon",
    "district_name": "Köprübaşı",
    "name": "Akpınar",
    "name_ascii": "akpinar",
    "slug": "akpinar-mahalle-koprubasi-trabzon-0001",
    "source": "e-icisleri-mulki-idare-bolumleri",
    "source_file": "Mahalle_Listesi.xls",
    "source_row": 30629
  },
  {
    "id": "TR-Y-61-010-M-0002",
    "level": "yerlesim",
    "type": "mahalle",
    "parent_id": "TR-D-61-010",
    "province_id": "TR-P-61",
    "district_id": "TR-D-61-010",
    "province_name": "Trabzon",
    "district_name": "Köprübaşı",
    "name": "Arpalı",
    "name_ascii": "arpali",
    "slug": "arpali-mahalle-koprubasi-trabzon-0002",
    "source": "e-icisleri-mulki-idare-bolumleri",
    "source_file": "Mahalle_Listesi.xls",
    "source_row": 30632
  },
  {
    "id": "TR-Y-61-010-M-0003",
    "level": "yerlesim",
    "type": "mahalle",
    "parent_id": "TR-D-61-010",
    "province_id": "TR-P-61",
    "district_id": "TR-D-61-010",
    "province_name": "Trabzon",
    "district_name": "Köprübaşı",
    "name": "Beşköy",
    "name_ascii": "beskoy",
    "slug": "beskoy-mahalle-koprubasi-trabzon-0003",
    "source": "e-icisleri-mulki-idare-bolumleri",
    "source_file": "Mahalle_Listesi.xls",
    "source_row": 30636
  },
  {
    "id": "TR-Y-61-010-M-0004",
    "level": "yerlesim",
    "type": "mahalle",
    "parent_id": "TR-D-61-010",
    "province_id": "TR-P-61",
    "district_id": "TR-D-61-010",
    "province_name": "Trabzon",
    "district_name": "Köprübaşı",
    "name": "Büyükdoğanlı",
    "name_ascii": "buyukdoganli",
    "slug": "buyukdoganli-mahalle-koprubasi-trabzon-0004",
    "source": "e-icisleri-mulki-idare-bolumleri",
    "source_file": "Mahalle_Listesi.xls",
    "source_row": 30628
  },
  {
    "id": "TR-Y-61-010-M-0005",
    "level": "yerlesim",
    "type": "mahalle",
    "parent_id": "TR-D-61-010",
    "province_id": "TR-P-61",
    "district_id": "TR-D-61-010",
    "province_name": "Trabzon",
    "district_name": "Köprübaşı",
    "name": "Çifteköprü",
    "name_ascii": "ciftekopru",
    "slug": "ciftekopru-mahalle-koprubasi-trabzon-0005",
    "source": "e-icisleri-mulki-idare-bolumleri",
    "source_file": "Mahalle_Listesi.xls",
    "source_row": 30633
  },
  {
    "id": "TR-Y-61-010-M-0006",
    "level": "yerlesim",
    "type": "mahalle",
    "parent_id": "TR-D-61-010",
    "province_id": "TR-P-61",
    "district_id": "TR-D-61-010",
    "province_name": "Trabzon",
    "district_name": "Köprübaşı",
    "name": "Fidanlı",
    "name_ascii": "fidanli",
    "slug": "fidanli-mahalle-koprubasi-trabzon-0006",
    "source": "e-icisleri-mulki-idare-bolumleri",
    "source_file": "Mahalle_Listesi.xls",
    "source_row": 30630
  },
  {
    "id": "TR-Y-61-010-M-0007",
    "level": "yerlesim",
    "type": "mahalle",
    "parent_id": "TR-D-61-010",
    "province_id": "TR-P-61",
    "district_id": "TR-D-61-010",
    "province_name": "Trabzon",
    "district_name": "Köprübaşı",
    "name": "Gündoğan",
    "name_ascii": "gundogan",
    "slug": "gundogan-mahalle-koprubasi-trabzon-0007",
    "source": "e-icisleri-mulki-idare-bolumleri",
    "source_file": "Mahalle_Listesi.xls",
    "source_row": 30631
  },
  {
    "id": "TR-Y-61-010-M-0008",
    "level": "yerlesim",
    "type": "mahalle",
    "parent_id": "TR-D-61-010",
    "province_id": "TR-P-61",
    "district_id": "TR-D-61-010",
    "province_name": "Trabzon",
    "district_name": "Köprübaşı",
    "name": "Güneşli",
    "name_ascii": "gunesli",
    "slug": "gunesli-mahalle-koprubasi-trabzon-0008",
    "source": "e-icisleri-mulki-idare-bolumleri",
    "source_file": "Mahalle_Listesi.xls",
    "source_row": 30634
  },
  {
    "id": "TR-Y-61-010-M-0009",
    "level": "yerlesim",
    "type": "mahalle",
    "parent_id": "TR-D-61-010",
    "province_id": "TR-P-61",
    "district_id": "TR-D-61-010",
    "province_name": "Trabzon",
    "district_name": "Köprübaşı",
    "name": "Pınarbaşı",
    "name_ascii": "pinarbasi",
    "slug": "pinarbasi-mahalle-koprubasi-trabzon-0009",
    "source": "e-icisleri-mulki-idare-bolumleri",
    "source_file": "Mahalle_Listesi.xls",
    "source_row": 30627
  },
  {
    "id": "TR-Y-61-010-M-0010",
    "level": "yerlesim",
    "type": "mahalle",
    "parent_id": "TR-D-61-010",
    "province_id": "TR-P-61",
    "district_id": "TR-D-61-010",
    "province_name": "Trabzon",
    "district_name": "Köprübaşı",
    "name": "Yağmurlu",
    "name_ascii": "yagmurlu",
    "slug": "yagmurlu-mahalle-koprubasi-trabzon-0010",
    "source": "e-icisleri-mulki-idare-bolumleri",
    "source_file": "Mahalle_Listesi.xls",
    "source_row": 30635
  }
]
