[
  {
    "id": "TR-Y-19-011-K-0001",
    "level": "yerlesim",
    "type": "koy",
    "parent_id": "TR-D-19-011",
    "province_id": "TR-P-19",
    "district_id": "TR-D-19-011",
    "province_name": "Çorum",
    "district_name": "Ortaköy",
    "name": "Asar",
    "name_ascii": "asar",
    "slug": "asar-koy-ortakoy-corum-0001",
    "source": "e-icisleri-mulki-idare-bolumleri",
    "source_file": "Koy_Listesi.xls",
    "source_row": 12428
  },
  {
    "id": "TR-Y-19-011-K-0002",
    "level": "yerlesim",
    "type": "koy",
    "parent_id": "TR-D-19-011",
    "province_id": "TR-P-19",
    "district_id": "TR-D-19-011",
    "province_name": "Çorum",
    "district_name": "Ortaköy",
    "name": "Büyükkışla",
    "name_ascii": "buyukkisla",
    "slug": "buyukkisla-koy-ortakoy-corum-0002",
    "source": "e-icisleri-mulki-idare-bolumleri",
    "source_file": "Koy_Listesi.xls",
    "source_row": 12430
  },
  {
    "id": "TR-Y-19-011-K-0003",
    "level": "yerlesim",
    "type": "koy",
    "parent_id": "TR-D-19-011",
    "province_id": "TR-P-19",
    "district_id": "TR-D-19-011",
    "province_name": "Çorum",
    "district_name": "Ortaköy",
    "name": "Cevizli",
    "name_ascii": "cevizli",
    "slug": "cevizli-koy-ortakoy-corum-0003",
    "source": "e-icisleri-mulki-idare-bolumleri",
    "source_file": "Koy_Listesi.xls",
    "source_row": 12432
  },
  {
    "id": "TR-Y-19-011-K-0004",
    "level": "yerlesim",
    "type": "koy",
    "parent_id": "TR-D-19-011",
    "province_id": "TR-P-19",
    "district_id": "TR-D-19-011",
    "province_name": "Çorum",
    "district_name": "Ortaköy",
    "name": "Esentepe",
    "name_ascii": "esentepe",
    "slug": "esentepe-koy-ortakoy-corum-0004",
    "source": "e-icisleri-mulki-idare-bolumleri",
    "source_file": "Koy_Listesi.xls",
    "source_row": 12434
  },
  {
    "id": "TR-Y-19-011-K-0005",
    "level": "yerlesim",
    "type": "koy",
    "parent_id": "TR-D-19-011",
    "province_id": "TR-P-19",
    "district_id": "TR-D-19-011",
    "province_name": "Çorum",
    "district_name": "Ortaköy",
    "name": "Fındıklı",
    "name_ascii": "findikli",
    "slug": "findikli-koy-ortakoy-corum-0005",
    "source": "e-icisleri-mulki-idare-bolumleri",
    "source_file": "Koy_Listesi.xls",
    "source_row": 12436
  },
  {
    "id": "TR-Y-19-011-K-0006",
    "level": "yerlesim",
    "type": "koy",
    "parent_id": "TR-D-19-011",
    "province_id": "TR-P-19",
    "district_id": "TR-D-19-011",
    "province_name": "Çorum",
    "district_name": "Ortaköy",
    "name": "İncesu",
    "name_ascii": "incesu",
    "slug": "incesu-koy-ortakoy-corum-0006",
    "source": "e-icisleri-mulki-idare-bolumleri",
    "source_file": "Koy_Listesi.xls",
    "source_row": 12438
  },
  {
    "id": "TR-Y-19-011-K-0007",
    "level": "yerlesim",
    "type": "koy",
    "parent_id": "TR-D-19-011",
    "province_id": "TR-P-19",
    "district_id": "TR-D-19-011",
    "province_name": "Çorum",
    "district_name": "Ortaköy",
    "name": "Karahacip",
    "name_ascii": "karahacip",
    "slug": "karahacip-koy-ortakoy-corum-0007",
    "source": "e-icisleri-mulki-idare-bolumleri",
    "source_file": "Koy_Listesi.xls",
    "source_row": 12440
  },
  {
    "id": "TR-Y-19-011-K-0008",
    "level": "yerlesim",
    "type": "koy",
    "parent_id": "TR-D-19-011",
    "province_id": "TR-P-19",
    "district_id": "TR-D-19-011",
    "province_name": "Çorum",
    "district_name": "Ortaköy",
    "name": "Kavakalanı",
    "name_ascii": "kavakalani",
    "slug": "kavakalani-koy-ortakoy-corum-0008",
    "source": "e-icisleri-mulki-idare-bolumleri",
    "source_file": "Koy_Listesi.xls",
    "source_row": 12442
  },
  {
    "id": "TR-Y-19-011-K-0009",
    "level": "yerlesim",
    "type": "koy",
    "parent_id": "TR-D-19-011",
    "province_id": "TR-P-19",
    "district_id": "TR-D-19-011",
    "province_name": "Çorum",
    "district_name": "Ortaköy",
    "name": "Kızılhamza",
    "name_ascii": "kizilhamza",
    "slug": "kizilhamza-koy-ortakoy-corum-0009",
    "source": "e-icisleri-mulki-idare-bolumleri",
    "source_file": "Koy_Listesi.xls",
    "source_row": 12444
  },
  {
    "id": "TR-Y-19-011-K-0010",
    "level": "yerlesim",
    "type": "koy",
    "parent_id": "TR-D-19-011",
    "province_id": "TR-P-19",
    "district_id": "TR-D-19-011",
    "province_name": "Çorum",
    "district_name": "Ortaköy",
    "name": "Oruçpınar",
    "name_ascii": "orucpinar",
    "slug": "orucpinar-koy-ortakoy-corum-0010",
    "source": "e-icisleri-mulki-idare-bolumleri",
    "source_file": "Koy_Listesi.xls",
    "source_row": 12446
  },
  {
    "id": "TR-Y-19-011-K-0011",
    "level": "yerlesim",
    "type": "koy",
    "parent_id": "TR-D-19-011",
    "province_id": "TR-P-19",
    "district_id": "TR-D-19-011",
    "province_name": "Çorum",
    "district_name": "Ortaköy",
    "name": "Salbaş",
    "name_ascii": "salbas",
    "slug": "salbas-koy-ortakoy-corum-0011",
    "source": "e-icisleri-mulki-idare-bolumleri",
    "source_file": "Koy_Listesi.xls",
    "source_row": 12448
  },
  {
    "id": "TR-Y-19-011-K-0012",
    "level": "yerlesim",
    "type": "koy",
    "parent_id": "TR-D-19-011",
    "province_id": "TR-P-19",
    "district_id": "TR-D-19-011",
    "province_name": "Çorum",
    "district_name": "Ortaköy",
    "name": "Senemoğlu",
    "name_ascii": "senemoglu",
    "slug": "senemoglu-koy-ortakoy-corum-0012",
    "source": "e-icisleri-mulki-idare-bolumleri",
    "source_file": "Koy_Listesi.xls",
    "source_row": 12450
  },
  {
    "id": "TR-Y-19-011-K-0013",
    "level": "yerlesim",
    "type": "koy",
    "parent_id": "TR-D-19-011",
    "province_id": "TR-P-19",
    "district_id": "TR-D-19-011",
    "province_name": "Çorum",
    "district_name": "Ortaköy",
    "name": "Yaylacık",
    "name_ascii": "yaylacik",
    "slug": "yaylacik-koy-ortakoy-corum-0013",
    "source": "e-icisleri-mulki-idare-bolumleri",
    "source_file": "Koy_Listesi.xls",
    "source_row": 12451
  },
  {
    "id": "TR-Y-19-011-K-0014",
    "level": "yerlesim",
    "type": "koy",
    "parent_id": "TR-D-19-011",
    "province_id": "TR-P-19",
    "district_id": "TR-D-19-011",
    "province_name": "Çorum",
    "district_name": "Ortaköy",
    "name": "Yukarıkuyucak",
    "name_ascii": "yukarikuyucak",
    "slug": "yukarikuyucak-koy-ortakoy-corum-0014",
    "source": "e-icisleri-mulki-idare-bolumleri",
    "source_file": "Koy_Listesi.xls",
    "source_row": 12453
  },
  {
    "id": "TR-Y-19-011-M-0001",
    "level": "yerlesim",
    "type": "mahalle",
    "parent_id": "TR-D-19-011",
    "province_id": "TR-P-19",
    "district_id": "TR-D-19-011",
    "province_name": "Çorum",
    "district_name": "Ortaköy",
    "name": "Bahçelievler",
    "name_ascii": "bahcelievler",
    "slug": "bahcelievler-mahalle-ortakoy-corum-0001",
    "source": "e-icisleri-mulki-idare-bolumleri",
    "source_file": "Mahalle_Listesi.xls",
    "source_row": 8080
  },
  {
    "id": "TR-Y-19-011-M-0002",
    "level": "yerlesim",
    "type": "mahalle",
    "parent_id": "TR-D-19-011",
    "province_id": "TR-P-19",
    "district_id": "TR-D-19-011",
    "province_name": "Çorum",
    "district_name": "Ortaköy",
    "name": "Bahçelievler",
    "name_ascii": "bahcelievler",
    "slug": "bahcelievler-mahalle-ortakoy-corum-0002",
    "source": "e-icisleri-mulki-idare-bolumleri",
    "source_file": "Mahalle_Listesi.xls",
    "source_row": 8082
  },
  {
    "id": "TR-Y-19-011-M-0003",
    "level": "yerlesim",
    "type": "mahalle",
    "parent_id": "TR-D-19-011",
    "province_id": "TR-P-19",
    "district_id": "TR-D-19-011",
    "province_name": "Çorum",
    "district_name": "Ortaköy",
    "name": "Cumhuriyet",
    "name_ascii": "cumhuriyet",
    "slug": "cumhuriyet-mahalle-ortakoy-corum-0003",
    "source": "e-icisleri-mulki-idare-bolumleri",
    "source_file": "Mahalle_Listesi.xls",
    "source_row": 8084
  },
  {
    "id": "TR-Y-19-011-M-0004",
    "level": "yerlesim",
    "type": "mahalle",
    "parent_id": "TR-D-19-011",
    "province_id": "TR-P-19",
    "district_id": "TR-D-19-011",
    "province_name": "Çorum",
    "district_name": "Ortaköy",
    "name": "Şirinevler",
    "name_ascii": "sirinevler",
    "slug": "sirinevler-mahalle-ortakoy-corum-0004",
    "source": "e-icisleri-mulki-idare-bolumleri",
    "source_file": "Mahalle_Listesi.xls",
    "source_row": 8081
  },
  {
    "id": "TR-Y-19-011-M-0005",
    "level": "yerlesim",
    "type": "mahalle",
    "parent_id": "TR-D-19-011",
    "province_id": "TR-P-19",
    "district_id": "TR-D-19-011",
    "province_name": "Çorum",
    "district_name": "Ortaköy",
    "name": "Suyolu",
    "name_ascii": "suyolu",
    "slug": "suyolu-mahalle-ortakoy-corum-0005",
    "source": "e-icisleri-mulki-idare-bolumleri",
    "source_file": "Mahalle_Listesi.xls",
    "source_row": 8083
  }
]
