[
  {
    "id": "TR-Y-25-019-M-0001",
    "level": "yerlesim",
    "type": "mahalle",
    "parent_id": "TR-D-25-019",
    "province_id": "TR-P-25",
    "district_id": "TR-D-25-019",
    "province_name": "Erzurum",
    "district_name": "Uzundere",
    "name": "Altınçanak",
    "name_ascii": "altincanak",
    "slug": "altincanak-mahalle-uzundere-erzurum-0001",
    "source": "e-icisleri-mulki-idare-bolumleri",
    "source_file": "Mahalle_Listesi.xls",
    "source_row": 11476
  },
  {
    "id": "TR-Y-25-019-M-0002",
    "level": "yerlesim",
    "type": "mahalle",
    "parent_id": "TR-D-25-019",
    "province_id": "TR-P-25",
    "district_id": "TR-D-25-019",
    "province_name": "Erzurum",
    "district_name": "Uzundere",
    "name": "Balıklı",
    "name_ascii": "balikli",
    "slug": "balikli-mahalle-uzundere-erzurum-0002",
    "source": "e-icisleri-mulki-idare-bolumleri",
    "source_file": "Mahalle_Listesi.xls",
    "source_row": 11477
  },
  {
    "id": "TR-Y-25-019-M-0003",
    "level": "yerlesim",
    "type": "mahalle",
    "parent_id": "TR-D-25-019",
    "province_id": "TR-P-25",
    "district_id": "TR-D-25-019",
    "province_name": "Erzurum",
    "district_name": "Uzundere",
    "name": "Çağlayan",
    "name_ascii": "caglayan",
    "slug": "caglayan-mahalle-uzundere-erzurum-0003",
    "source": "e-icisleri-mulki-idare-bolumleri",
    "source_file": "Mahalle_Listesi.xls",
    "source_row": 11479
  },
  {
    "id": "TR-Y-25-019-M-0004",
    "level": "yerlesim",
    "type": "mahalle",
    "parent_id": "TR-D-25-019",
    "province_id": "TR-P-25",
    "district_id": "TR-D-25-019",
    "province_name": "Erzurum",
    "district_name": "Uzundere",
    "name": "Çamlıyamaç",
    "name_ascii": "camliyamac",
    "slug": "camliyamac-mahalle-uzundere-erzurum-0004",
    "source": "e-icisleri-mulki-idare-bolumleri",
    "source_file": "Mahalle_Listesi.xls",
    "source_row": 11480
  },
  {
    "id": "TR-Y-25-019-M-0005",
    "level": "yerlesim",
    "type": "mahalle",
    "parent_id": "TR-D-25-019",
    "province_id": "TR-P-25",
    "district_id": "TR-D-25-019",
    "province_name": "Erzurum",
    "district_name": "Uzundere",
    "name": "Çaybaşı",
    "name_ascii": "caybasi",
    "slug": "caybasi-mahalle-uzundere-erzurum-0005",
    "source": "e-icisleri-mulki-idare-bolumleri",
    "source_file": "Mahalle_Listesi.xls",
    "source_row": 11469
  },
  {
    "id": "TR-Y-25-019-M-0006",
    "level": "yerlesim",
    "type": "mahalle",
    "parent_id": "TR-D-25-019",
    "province_id": "TR-P-25",
    "district_id": "TR-D-25-019",
    "province_name": "Erzurum",
    "district_name": "Uzundere",
    "name": "Cevizli",
    "name_ascii": "cevizli",
    "slug": "cevizli-mahalle-uzundere-erzurum-0006",
    "source": "e-icisleri-mulki-idare-bolumleri",
    "source_file": "Mahalle_Listesi.xls",
    "source_row": 11478
  },
  {
    "id": "TR-Y-25-019-M-0007",
    "level": "yerlesim",
    "type": "mahalle",
    "parent_id": "TR-D-25-019",
    "province_id": "TR-P-25",
    "district_id": "TR-D-25-019",
    "province_name": "Erzurum",
    "district_name": "Uzundere",
    "name": "Cömertler",
    "name_ascii": "comertler",
    "slug": "comertler-mahalle-uzundere-erzurum-0007",
    "source": "e-icisleri-mulki-idare-bolumleri",
    "source_file": "Mahalle_Listesi.xls",
    "source_row": 11468
  },
  {
    "id": "TR-Y-25-019-M-0008",
    "level": "yerlesim",
    "type": "mahalle",
    "parent_id": "TR-D-25-019",
    "province_id": "TR-P-25",
    "district_id": "TR-D-25-019",
    "province_name": "Erzurum",
    "district_name": "Uzundere",
    "name": "Dikyar",
    "name_ascii": "dikyar",
    "slug": "dikyar-mahalle-uzundere-erzurum-0008",
    "source": "e-icisleri-mulki-idare-bolumleri",
    "source_file": "Mahalle_Listesi.xls",
    "source_row": 11481
  },
  {
    "id": "TR-Y-25-019-M-0009",
    "level": "yerlesim",
    "type": "mahalle",
    "parent_id": "TR-D-25-019",
    "province_id": "TR-P-25",
    "district_id": "TR-D-25-019",
    "province_name": "Erzurum",
    "district_name": "Uzundere",
    "name": "Erikli",
    "name_ascii": "erikli",
    "slug": "erikli-mahalle-uzundere-erzurum-0009",
    "source": "e-icisleri-mulki-idare-bolumleri",
    "source_file": "Mahalle_Listesi.xls",
    "source_row": 11470
  },
  {
    "id": "TR-Y-25-019-M-0010",
    "level": "yerlesim",
    "type": "mahalle",
    "parent_id": "TR-D-25-019",
    "province_id": "TR-P-25",
    "district_id": "TR-D-25-019",
    "province_name": "Erzurum",
    "district_name": "Uzundere",
    "name": "Gölbaşı",
    "name_ascii": "golbasi",
    "slug": "golbasi-mahalle-uzundere-erzurum-0010",
    "source": "e-icisleri-mulki-idare-bolumleri",
    "source_file": "Mahalle_Listesi.xls",
    "source_row": 11482
  },
  {
    "id": "TR-Y-25-019-M-0011",
    "level": "yerlesim",
    "type": "mahalle",
    "parent_id": "TR-D-25-019",
    "province_id": "TR-P-25",
    "district_id": "TR-D-25-019",
    "province_name": "Erzurum",
    "district_name": "Uzundere",
    "name": "Kirazlı",
    "name_ascii": "kirazli",
    "slug": "kirazli-mahalle-uzundere-erzurum-0011",
    "source": "e-icisleri-mulki-idare-bolumleri",
    "source_file": "Mahalle_Listesi.xls",
    "source_row": 11483
  },
  {
    "id": "TR-Y-25-019-M-0012",
    "level": "yerlesim",
    "type": "mahalle",
    "parent_id": "TR-D-25-019",
    "province_id": "TR-P-25",
    "district_id": "TR-D-25-019",
    "province_name": "Erzurum",
    "district_name": "Uzundere",
    "name": "Merkez",
    "name_ascii": "merkez",
    "slug": "merkez-mahalle-uzundere-erzurum-0012",
    "source": "e-icisleri-mulki-idare-bolumleri",
    "source_file": "Mahalle_Listesi.xls",
    "source_row": 11472
  },
  {
    "id": "TR-Y-25-019-M-0013",
    "level": "yerlesim",
    "type": "mahalle",
    "parent_id": "TR-D-25-019",
    "province_id": "TR-P-25",
    "district_id": "TR-D-25-019",
    "province_name": "Erzurum",
    "district_name": "Uzundere",
    "name": "Muratefendi",
    "name_ascii": "muratefendi",
    "slug": "muratefendi-mahalle-uzundere-erzurum-0013",
    "source": "e-icisleri-mulki-idare-bolumleri",
    "source_file": "Mahalle_Listesi.xls",
    "source_row": 11473
  },
  {
    "id": "TR-Y-25-019-M-0014",
    "level": "yerlesim",
    "type": "mahalle",
    "parent_id": "TR-D-25-019",
    "province_id": "TR-P-25",
    "district_id": "TR-D-25-019",
    "province_name": "Erzurum",
    "district_name": "Uzundere",
    "name": "Pehlivanlı",
    "name_ascii": "pehlivanli",
    "slug": "pehlivanli-mahalle-uzundere-erzurum-0014",
    "source": "e-icisleri-mulki-idare-bolumleri",
    "source_file": "Mahalle_Listesi.xls",
    "source_row": 11467
  },
  {
    "id": "TR-Y-25-019-M-0015",
    "level": "yerlesim",
    "type": "mahalle",
    "parent_id": "TR-D-25-019",
    "province_id": "TR-P-25",
    "district_id": "TR-D-25-019",
    "province_name": "Erzurum",
    "district_name": "Uzundere",
    "name": "Sapaca",
    "name_ascii": "sapaca",
    "slug": "sapaca-mahalle-uzundere-erzurum-0015",
    "source": "e-icisleri-mulki-idare-bolumleri",
    "source_file": "Mahalle_Listesi.xls",
    "source_row": 11484
  },
  {
    "id": "TR-Y-25-019-M-0016",
    "level": "yerlesim",
    "type": "mahalle",
    "parent_id": "TR-D-25-019",
    "province_id": "TR-P-25",
    "district_id": "TR-D-25-019",
    "province_name": "Erzurum",
    "district_name": "Uzundere",
    "name": "Seyitefendi",
    "name_ascii": "seyitefendi",
    "slug": "seyitefendi-mahalle-uzundere-erzurum-0016",
    "source": "e-icisleri-mulki-idare-bolumleri",
    "source_file": "Mahalle_Listesi.xls",
    "source_row": 11474
  },
  {
    "id": "TR-Y-25-019-M-0017",
    "level": "yerlesim",
    "type": "mahalle",
    "parent_id": "TR-D-25-019",
    "province_id": "TR-P-25",
    "district_id": "TR-D-25-019",
    "province_name": "Erzurum",
    "district_name": "Uzundere",
    "name": "Ulubağ",
    "name_ascii": "ulubag",
    "slug": "ulubag-mahalle-uzundere-erzurum-0017",
    "source": "e-icisleri-mulki-idare-bolumleri",
    "source_file": "Mahalle_Listesi.xls",
    "source_row": 11485
  },
  {
    "id": "TR-Y-25-019-M-0018",
    "level": "yerlesim",
    "type": "mahalle",
    "parent_id": "TR-D-25-019",
    "province_id": "TR-P-25",
    "district_id": "TR-D-25-019",
    "province_name": "Erzurum",
    "district_name": "Uzundere",
    "name": "Uzundere",
    "name_ascii": "uzundere",
    "slug": "uzundere-mahalle-uzundere-erzurum-0018",
    "source": "e-icisleri-mulki-idare-bolumleri",
    "source_file": "Mahalle_Listesi.xls",
    "source_row": 11471
  },
  {
    "id": "TR-Y-25-019-M-0019",
    "level": "yerlesim",
    "type": "mahalle",
    "parent_id": "TR-D-25-019",
    "province_id": "TR-P-25",
    "district_id": "TR-D-25-019",
    "province_name": "Erzurum",
    "district_name": "Uzundere",
    "name": "Yayla",
    "name_ascii": "yayla",
    "slug": "yayla-mahalle-uzundere-erzurum-0019",
    "source": "e-icisleri-mulki-idare-bolumleri",
    "source_file": "Mahalle_Listesi.xls",
    "source_row": 11475
  }
]
