[
  {
    "id": "TR-Y-42-008-M-0001",
    "level": "yerlesim",
    "type": "mahalle",
    "parent_id": "TR-D-42-008",
    "province_id": "TR-P-42",
    "district_id": "TR-D-42-008",
    "province_name": "Konya",
    "district_name": "Çeltik",
    "name": "Adakasım",
    "name_ascii": "adakasim",
    "slug": "adakasim-mahalle-celtik-konya-0001",
    "source": "e-icisleri-mulki-idare-bolumleri",
    "source_file": "Mahalle_Listesi.xls",
    "source_row": 19265
  },
  {
    "id": "TR-Y-42-008-M-0002",
    "level": "yerlesim",
    "type": "mahalle",
    "parent_id": "TR-D-42-008",
    "province_id": "TR-P-42",
    "district_id": "TR-D-42-008",
    "province_name": "Konya",
    "district_name": "Çeltik",
    "name": "Bahçelievler",
    "name_ascii": "bahcelievler",
    "slug": "bahcelievler-mahalle-celtik-konya-0002",
    "source": "e-icisleri-mulki-idare-bolumleri",
    "source_file": "Mahalle_Listesi.xls",
    "source_row": 19273
  },
  {
    "id": "TR-Y-42-008-M-0003",
    "level": "yerlesim",
    "type": "mahalle",
    "parent_id": "TR-D-42-008",
    "province_id": "TR-P-42",
    "district_id": "TR-D-42-008",
    "province_name": "Konya",
    "district_name": "Çeltik",
    "name": "Bahçesaray",
    "name_ascii": "bahcesaray",
    "slug": "bahcesaray-mahalle-celtik-konya-0003",
    "source": "e-icisleri-mulki-idare-bolumleri",
    "source_file": "Mahalle_Listesi.xls",
    "source_row": 19276
  },
  {
    "id": "TR-Y-42-008-M-0004",
    "level": "yerlesim",
    "type": "mahalle",
    "parent_id": "TR-D-42-008",
    "province_id": "TR-P-42",
    "district_id": "TR-D-42-008",
    "province_name": "Konya",
    "district_name": "Çeltik",
    "name": "Doğanyurt",
    "name_ascii": "doganyurt",
    "slug": "doganyurt-mahalle-celtik-konya-0004",
    "source": "e-icisleri-mulki-idare-bolumleri",
    "source_file": "Mahalle_Listesi.xls",
    "source_row": 19266
  },
  {
    "id": "TR-Y-42-008-M-0005",
    "level": "yerlesim",
    "type": "mahalle",
    "parent_id": "TR-D-42-008",
    "province_id": "TR-P-42",
    "district_id": "TR-D-42-008",
    "province_name": "Konya",
    "district_name": "Çeltik",
    "name": "Fatih",
    "name_ascii": "fatih",
    "slug": "fatih-mahalle-celtik-konya-0005",
    "source": "e-icisleri-mulki-idare-bolumleri",
    "source_file": "Mahalle_Listesi.xls",
    "source_row": 19274
  },
  {
    "id": "TR-Y-42-008-M-0006",
    "level": "yerlesim",
    "type": "mahalle",
    "parent_id": "TR-D-42-008",
    "province_id": "TR-P-42",
    "district_id": "TR-D-42-008",
    "province_name": "Konya",
    "district_name": "Çeltik",
    "name": "Gökpınar",
    "name_ascii": "gokpinar",
    "slug": "gokpinar-mahalle-celtik-konya-0006",
    "source": "e-icisleri-mulki-idare-bolumleri",
    "source_file": "Mahalle_Listesi.xls",
    "source_row": 19271
  },
  {
    "id": "TR-Y-42-008-M-0007",
    "level": "yerlesim",
    "type": "mahalle",
    "parent_id": "TR-D-42-008",
    "province_id": "TR-P-42",
    "district_id": "TR-D-42-008",
    "province_name": "Konya",
    "district_name": "Çeltik",
    "name": "Honamlı",
    "name_ascii": "honamli",
    "slug": "honamli-mahalle-celtik-konya-0007",
    "source": "e-icisleri-mulki-idare-bolumleri",
    "source_file": "Mahalle_Listesi.xls",
    "source_row": 19278
  },
  {
    "id": "TR-Y-42-008-M-0008",
    "level": "yerlesim",
    "type": "mahalle",
    "parent_id": "TR-D-42-008",
    "province_id": "TR-P-42",
    "district_id": "TR-D-42-008",
    "province_name": "Konya",
    "district_name": "Çeltik",
    "name": "İshakuşağı",
    "name_ascii": "ishakusagi",
    "slug": "ishakusagi-mahalle-celtik-konya-0008",
    "source": "e-icisleri-mulki-idare-bolumleri",
    "source_file": "Mahalle_Listesi.xls",
    "source_row": 19267
  },
  {
    "id": "TR-Y-42-008-M-0009",
    "level": "yerlesim",
    "type": "mahalle",
    "parent_id": "TR-D-42-008",
    "province_id": "TR-P-42",
    "district_id": "TR-D-42-008",
    "province_name": "Konya",
    "district_name": "Çeltik",
    "name": "Karşıyaka",
    "name_ascii": "karsiyaka",
    "slug": "karsiyaka-mahalle-celtik-konya-0009",
    "source": "e-icisleri-mulki-idare-bolumleri",
    "source_file": "Mahalle_Listesi.xls",
    "source_row": 19277
  },
  {
    "id": "TR-Y-42-008-M-0010",
    "level": "yerlesim",
    "type": "mahalle",
    "parent_id": "TR-D-42-008",
    "province_id": "TR-P-42",
    "district_id": "TR-D-42-008",
    "province_name": "Konya",
    "district_name": "Çeltik",
    "name": "Kaşören",
    "name_ascii": "kasoren",
    "slug": "kasoren-mahalle-celtik-konya-0010",
    "source": "e-icisleri-mulki-idare-bolumleri",
    "source_file": "Mahalle_Listesi.xls",
    "source_row": 19268
  },
  {
    "id": "TR-Y-42-008-M-0011",
    "level": "yerlesim",
    "type": "mahalle",
    "parent_id": "TR-D-42-008",
    "province_id": "TR-P-42",
    "district_id": "TR-D-42-008",
    "province_name": "Konya",
    "district_name": "Çeltik",
    "name": "Küçükhasan",
    "name_ascii": "kucukhasan",
    "slug": "kucukhasan-mahalle-celtik-konya-0011",
    "source": "e-icisleri-mulki-idare-bolumleri",
    "source_file": "Mahalle_Listesi.xls",
    "source_row": 19272
  },
  {
    "id": "TR-Y-42-008-M-0012",
    "level": "yerlesim",
    "type": "mahalle",
    "parent_id": "TR-D-42-008",
    "province_id": "TR-P-42",
    "district_id": "TR-D-42-008",
    "province_name": "Konya",
    "district_name": "Çeltik",
    "name": "Selçuk",
    "name_ascii": "selcuk",
    "slug": "selcuk-mahalle-celtik-konya-0012",
    "source": "e-icisleri-mulki-idare-bolumleri",
    "source_file": "Mahalle_Listesi.xls",
    "source_row": 19275
  },
  {
    "id": "TR-Y-42-008-M-0013",
    "level": "yerlesim",
    "type": "mahalle",
    "parent_id": "TR-D-42-008",
    "province_id": "TR-P-42",
    "district_id": "TR-D-42-008",
    "province_name": "Konya",
    "district_name": "Çeltik",
    "name": "Torunlar",
    "name_ascii": "torunlar",
    "slug": "torunlar-mahalle-celtik-konya-0013",
    "source": "e-icisleri-mulki-idare-bolumleri",
    "source_file": "Mahalle_Listesi.xls",
    "source_row": 19269
  },
  {
    "id": "TR-Y-42-008-M-0014",
    "level": "yerlesim",
    "type": "mahalle",
    "parent_id": "TR-D-42-008",
    "province_id": "TR-P-42",
    "district_id": "TR-D-42-008",
    "province_name": "Konya",
    "district_name": "Çeltik",
    "name": "Yukarı Aliçomak",
    "name_ascii": "yukari alicomak",
    "slug": "yukari-alicomak-mahalle-celtik-konya-0014",
    "source": "e-icisleri-mulki-idare-bolumleri",
    "source_file": "Mahalle_Listesi.xls",
    "source_row": 19270
  }
]
