[
  {
    "id": "TR-Y-42-010-M-0001",
    "level": "yerlesim",
    "type": "mahalle",
    "parent_id": "TR-D-42-010",
    "province_id": "TR-P-42",
    "district_id": "TR-D-42-010",
    "province_name": "Konya",
    "district_name": "Derbent",
    "name": "Arapözü",
    "name_ascii": "arapozu",
    "slug": "arapozu-mahalle-derbent-konya-0001",
    "source": "e-icisleri-mulki-idare-bolumleri",
    "source_file": "Mahalle_Listesi.xls",
    "source_row": 19337
  },
  {
    "id": "TR-Y-42-010-M-0002",
    "level": "yerlesim",
    "type": "mahalle",
    "parent_id": "TR-D-42-010",
    "province_id": "TR-P-42",
    "district_id": "TR-D-42-010",
    "province_name": "Konya",
    "district_name": "Derbent",
    "name": "Camiikebir",
    "name_ascii": "camiikebir",
    "slug": "camiikebir-mahalle-derbent-konya-0002",
    "source": "e-icisleri-mulki-idare-bolumleri",
    "source_file": "Mahalle_Listesi.xls",
    "source_row": 19339
  },
  {
    "id": "TR-Y-42-010-M-0003",
    "level": "yerlesim",
    "type": "mahalle",
    "parent_id": "TR-D-42-010",
    "province_id": "TR-P-42",
    "district_id": "TR-D-42-010",
    "province_name": "Konya",
    "district_name": "Derbent",
    "name": "Çiftliközü",
    "name_ascii": "ciftlikozu",
    "slug": "ciftlikozu-mahalle-derbent-konya-0003",
    "source": "e-icisleri-mulki-idare-bolumleri",
    "source_file": "Mahalle_Listesi.xls",
    "source_row": 19338
  },
  {
    "id": "TR-Y-42-010-M-0004",
    "level": "yerlesim",
    "type": "mahalle",
    "parent_id": "TR-D-42-010",
    "province_id": "TR-P-42",
    "district_id": "TR-D-42-010",
    "province_name": "Konya",
    "district_name": "Derbent",
    "name": "Değiş",
    "name_ascii": "degis",
    "slug": "degis-mahalle-derbent-konya-0004",
    "source": "e-icisleri-mulki-idare-bolumleri",
    "source_file": "Mahalle_Listesi.xls",
    "source_row": 19332
  },
  {
    "id": "TR-Y-42-010-M-0005",
    "level": "yerlesim",
    "type": "mahalle",
    "parent_id": "TR-D-42-010",
    "province_id": "TR-P-42",
    "district_id": "TR-D-42-010",
    "province_name": "Konya",
    "district_name": "Derbent",
    "name": "Derbenttekke",
    "name_ascii": "derbenttekke",
    "slug": "derbenttekke-mahalle-derbent-konya-0005",
    "source": "e-icisleri-mulki-idare-bolumleri",
    "source_file": "Mahalle_Listesi.xls",
    "source_row": 19333
  },
  {
    "id": "TR-Y-42-010-M-0006",
    "level": "yerlesim",
    "type": "mahalle",
    "parent_id": "TR-D-42-010",
    "province_id": "TR-P-42",
    "district_id": "TR-D-42-010",
    "province_name": "Konya",
    "district_name": "Derbent",
    "name": "Güney",
    "name_ascii": "guney",
    "slug": "guney-mahalle-derbent-konya-0006",
    "source": "e-icisleri-mulki-idare-bolumleri",
    "source_file": "Mahalle_Listesi.xls",
    "source_row": 19340
  },
  {
    "id": "TR-Y-42-010-M-0007",
    "level": "yerlesim",
    "type": "mahalle",
    "parent_id": "TR-D-42-010",
    "province_id": "TR-P-42",
    "district_id": "TR-D-42-010",
    "province_name": "Konya",
    "district_name": "Derbent",
    "name": "Güneyköy",
    "name_ascii": "guneykoy",
    "slug": "guneykoy-mahalle-derbent-konya-0007",
    "source": "e-icisleri-mulki-idare-bolumleri",
    "source_file": "Mahalle_Listesi.xls",
    "source_row": 19334
  },
  {
    "id": "TR-Y-42-010-M-0008",
    "level": "yerlesim",
    "type": "mahalle",
    "parent_id": "TR-D-42-010",
    "province_id": "TR-P-42",
    "district_id": "TR-D-42-010",
    "province_name": "Konya",
    "district_name": "Derbent",
    "name": "Hacıahmet",
    "name_ascii": "haciahmet",
    "slug": "haciahmet-mahalle-derbent-konya-0008",
    "source": "e-icisleri-mulki-idare-bolumleri",
    "source_file": "Mahalle_Listesi.xls",
    "source_row": 19341
  },
  {
    "id": "TR-Y-42-010-M-0009",
    "level": "yerlesim",
    "type": "mahalle",
    "parent_id": "TR-D-42-010",
    "province_id": "TR-P-42",
    "district_id": "TR-D-42-010",
    "province_name": "Konya",
    "district_name": "Derbent",
    "name": "Karalar",
    "name_ascii": "karalar",
    "slug": "karalar-mahalle-derbent-konya-0009",
    "source": "e-icisleri-mulki-idare-bolumleri",
    "source_file": "Mahalle_Listesi.xls",
    "source_row": 19344
  },
  {
    "id": "TR-Y-42-010-M-0010",
    "level": "yerlesim",
    "type": "mahalle",
    "parent_id": "TR-D-42-010",
    "province_id": "TR-P-42",
    "district_id": "TR-D-42-010",
    "province_name": "Konya",
    "district_name": "Derbent",
    "name": "Mülayim",
    "name_ascii": "mulayim",
    "slug": "mulayim-mahalle-derbent-konya-0010",
    "source": "e-icisleri-mulki-idare-bolumleri",
    "source_file": "Mahalle_Listesi.xls",
    "source_row": 19335
  },
  {
    "id": "TR-Y-42-010-M-0011",
    "level": "yerlesim",
    "type": "mahalle",
    "parent_id": "TR-D-42-010",
    "province_id": "TR-P-42",
    "district_id": "TR-D-42-010",
    "province_name": "Konya",
    "district_name": "Derbent",
    "name": "Saraypınar",
    "name_ascii": "saraypinar",
    "slug": "saraypinar-mahalle-derbent-konya-0011",
    "source": "e-icisleri-mulki-idare-bolumleri",
    "source_file": "Mahalle_Listesi.xls",
    "source_row": 19336
  },
  {
    "id": "TR-Y-42-010-M-0012",
    "level": "yerlesim",
    "type": "mahalle",
    "parent_id": "TR-D-42-010",
    "province_id": "TR-P-42",
    "district_id": "TR-D-42-010",
    "province_name": "Konya",
    "district_name": "Derbent",
    "name": "Süleyman",
    "name_ascii": "suleyman",
    "slug": "suleyman-mahalle-derbent-konya-0012",
    "source": "e-icisleri-mulki-idare-bolumleri",
    "source_file": "Mahalle_Listesi.xls",
    "source_row": 19343
  },
  {
    "id": "TR-Y-42-010-M-0013",
    "level": "yerlesim",
    "type": "mahalle",
    "parent_id": "TR-D-42-010",
    "province_id": "TR-P-42",
    "district_id": "TR-D-42-010",
    "province_name": "Konya",
    "district_name": "Derbent",
    "name": "Yukarı",
    "name_ascii": "yukari",
    "slug": "yukari-mahalle-derbent-konya-0013",
    "source": "e-icisleri-mulki-idare-bolumleri",
    "source_file": "Mahalle_Listesi.xls",
    "source_row": 19342
  }
]
