[
  {
    "id": "TR-Y-77-003-K-0001",
    "level": "yerlesim",
    "type": "koy",
    "parent_id": "TR-D-77-003",
    "province_id": "TR-P-77",
    "district_id": "TR-D-77-003",
    "province_name": "Yalova",
    "district_name": "Çiftlikköy",
    "name": "Burhaniye",
    "name_ascii": "burhaniye",
    "slug": "burhaniye-koy-ciftlikkoy-yalova-0001",
    "source": "e-icisleri-mulki-idare-bolumleri",
    "source_file": "Koy_Listesi.xls",
    "source_row": 33755
  },
  {
    "id": "TR-Y-77-003-K-0002",
    "level": "yerlesim",
    "type": "koy",
    "parent_id": "TR-D-77-003",
    "province_id": "TR-P-77",
    "district_id": "TR-D-77-003",
    "province_name": "Yalova",
    "district_name": "Çiftlikköy",
    "name": "Çukurköy",
    "name_ascii": "cukurkoy",
    "slug": "cukurkoy-koy-ciftlikkoy-yalova-0002",
    "source": "e-icisleri-mulki-idare-bolumleri",
    "source_file": "Koy_Listesi.xls",
    "source_row": 33757
  },
  {
    "id": "TR-Y-77-003-K-0003",
    "level": "yerlesim",
    "type": "koy",
    "parent_id": "TR-D-77-003",
    "province_id": "TR-P-77",
    "district_id": "TR-D-77-003",
    "province_name": "Yalova",
    "district_name": "Çiftlikköy",
    "name": "Denizçalı",
    "name_ascii": "denizcali",
    "slug": "denizcali-koy-ciftlikkoy-yalova-0003",
    "source": "e-icisleri-mulki-idare-bolumleri",
    "source_file": "Koy_Listesi.xls",
    "source_row": 33759
  },
  {
    "id": "TR-Y-77-003-K-0004",
    "level": "yerlesim",
    "type": "koy",
    "parent_id": "TR-D-77-003",
    "province_id": "TR-P-77",
    "district_id": "TR-D-77-003",
    "province_name": "Yalova",
    "district_name": "Çiftlikköy",
    "name": "Dereköy",
    "name_ascii": "derekoy",
    "slug": "derekoy-koy-ciftlikkoy-yalova-0004",
    "source": "e-icisleri-mulki-idare-bolumleri",
    "source_file": "Koy_Listesi.xls",
    "source_row": 33761
  },
  {
    "id": "TR-Y-77-003-K-0005",
    "level": "yerlesim",
    "type": "koy",
    "parent_id": "TR-D-77-003",
    "province_id": "TR-P-77",
    "district_id": "TR-D-77-003",
    "province_name": "Yalova",
    "district_name": "Çiftlikköy",
    "name": "Gacık",
    "name_ascii": "gacik",
    "slug": "gacik-koy-ciftlikkoy-yalova-0005",
    "source": "e-icisleri-mulki-idare-bolumleri",
    "source_file": "Koy_Listesi.xls",
    "source_row": 33763
  },
  {
    "id": "TR-Y-77-003-K-0006",
    "level": "yerlesim",
    "type": "koy",
    "parent_id": "TR-D-77-003",
    "province_id": "TR-P-77",
    "district_id": "TR-D-77-003",
    "province_name": "Yalova",
    "district_name": "Çiftlikköy",
    "name": "İlyasköy",
    "name_ascii": "ilyaskoy",
    "slug": "ilyaskoy-koy-ciftlikkoy-yalova-0006",
    "source": "e-icisleri-mulki-idare-bolumleri",
    "source_file": "Koy_Listesi.xls",
    "source_row": 33765
  },
  {
    "id": "TR-Y-77-003-K-0007",
    "level": "yerlesim",
    "type": "koy",
    "parent_id": "TR-D-77-003",
    "province_id": "TR-P-77",
    "district_id": "TR-D-77-003",
    "province_name": "Yalova",
    "district_name": "Çiftlikköy",
    "name": "Kabaklı",
    "name_ascii": "kabakli",
    "slug": "kabakli-koy-ciftlikkoy-yalova-0007",
    "source": "e-icisleri-mulki-idare-bolumleri",
    "source_file": "Koy_Listesi.xls",
    "source_row": 33767
  },
  {
    "id": "TR-Y-77-003-K-0008",
    "level": "yerlesim",
    "type": "koy",
    "parent_id": "TR-D-77-003",
    "province_id": "TR-P-77",
    "district_id": "TR-D-77-003",
    "province_name": "Yalova",
    "district_name": "Çiftlikköy",
    "name": "Kılıç",
    "name_ascii": "kilic",
    "slug": "kilic-koy-ciftlikkoy-yalova-0008",
    "source": "e-icisleri-mulki-idare-bolumleri",
    "source_file": "Koy_Listesi.xls",
    "source_row": 33769
  },
  {
    "id": "TR-Y-77-003-K-0009",
    "level": "yerlesim",
    "type": "koy",
    "parent_id": "TR-D-77-003",
    "province_id": "TR-P-77",
    "district_id": "TR-D-77-003",
    "province_name": "Yalova",
    "district_name": "Çiftlikköy",
    "name": "Laledere",
    "name_ascii": "laledere",
    "slug": "laledere-koy-ciftlikkoy-yalova-0009",
    "source": "e-icisleri-mulki-idare-bolumleri",
    "source_file": "Koy_Listesi.xls",
    "source_row": 33771
  },
  {
    "id": "TR-Y-77-003-M-0001",
    "level": "yerlesim",
    "type": "mahalle",
    "parent_id": "TR-D-77-003",
    "province_id": "TR-P-77",
    "district_id": "TR-D-77-003",
    "province_name": "Yalova",
    "district_name": "Çiftlikköy",
    "name": "500 Evler",
    "name_ascii": "500 evler",
    "slug": "500-evler-mahalle-ciftlikkoy-yalova-0001",
    "source": "e-icisleri-mulki-idare-bolumleri",
    "source_file": "Mahalle_Listesi.xls",
    "source_row": 31865
  },
  {
    "id": "TR-Y-77-003-M-0002",
    "level": "yerlesim",
    "type": "mahalle",
    "parent_id": "TR-D-77-003",
    "province_id": "TR-P-77",
    "district_id": "TR-D-77-003",
    "province_name": "Yalova",
    "district_name": "Çiftlikköy",
    "name": "Çiftlik",
    "name_ascii": "ciftlik",
    "slug": "ciftlik-mahalle-ciftlikkoy-yalova-0002",
    "source": "e-icisleri-mulki-idare-bolumleri",
    "source_file": "Mahalle_Listesi.xls",
    "source_row": 31861
  },
  {
    "id": "TR-Y-77-003-M-0003",
    "level": "yerlesim",
    "type": "mahalle",
    "parent_id": "TR-D-77-003",
    "province_id": "TR-P-77",
    "district_id": "TR-D-77-003",
    "province_name": "Yalova",
    "district_name": "Çiftlikköy",
    "name": "Mehmet Akif Ersoy",
    "name_ascii": "mehmet akif ersoy",
    "slug": "mehmet-akif-ersoy-mahalle-ciftlikkoy-yalova-0003",
    "source": "e-icisleri-mulki-idare-bolumleri",
    "source_file": "Mahalle_Listesi.xls",
    "source_row": 31860
  },
  {
    "id": "TR-Y-77-003-M-0004",
    "level": "yerlesim",
    "type": "mahalle",
    "parent_id": "TR-D-77-003",
    "province_id": "TR-P-77",
    "district_id": "TR-D-77-003",
    "province_name": "Yalova",
    "district_name": "Çiftlikköy",
    "name": "Merkez",
    "name_ascii": "merkez",
    "slug": "merkez-mahalle-ciftlikkoy-yalova-0004",
    "source": "e-icisleri-mulki-idare-bolumleri",
    "source_file": "Mahalle_Listesi.xls",
    "source_row": 31866
  },
  {
    "id": "TR-Y-77-003-M-0005",
    "level": "yerlesim",
    "type": "mahalle",
    "parent_id": "TR-D-77-003",
    "province_id": "TR-P-77",
    "district_id": "TR-D-77-003",
    "province_name": "Yalova",
    "district_name": "Çiftlikköy",
    "name": "Sahil",
    "name_ascii": "sahil",
    "slug": "sahil-mahalle-ciftlikkoy-yalova-0005",
    "source": "e-icisleri-mulki-idare-bolumleri",
    "source_file": "Mahalle_Listesi.xls",
    "source_row": 31862
  },
  {
    "id": "TR-Y-77-003-M-0006",
    "level": "yerlesim",
    "type": "mahalle",
    "parent_id": "TR-D-77-003",
    "province_id": "TR-P-77",
    "district_id": "TR-D-77-003",
    "province_name": "Yalova",
    "district_name": "Çiftlikköy",
    "name": "Siteler",
    "name_ascii": "siteler",
    "slug": "siteler-mahalle-ciftlikkoy-yalova-0006",
    "source": "e-icisleri-mulki-idare-bolumleri",
    "source_file": "Mahalle_Listesi.xls",
    "source_row": 31863
  },
  {
    "id": "TR-Y-77-003-M-0007",
    "level": "yerlesim",
    "type": "mahalle",
    "parent_id": "TR-D-77-003",
    "province_id": "TR-P-77",
    "district_id": "TR-D-77-003",
    "province_name": "Yalova",
    "district_name": "Çiftlikköy",
    "name": "Sultaniye",
    "name_ascii": "sultaniye",
    "slug": "sultaniye-mahalle-ciftlikkoy-yalova-0007",
    "source": "e-icisleri-mulki-idare-bolumleri",
    "source_file": "Mahalle_Listesi.xls",
    "source_row": 31864
  },
  {
    "id": "TR-Y-77-003-M-0008",
    "level": "yerlesim",
    "type": "mahalle",
    "parent_id": "TR-D-77-003",
    "province_id": "TR-P-77",
    "district_id": "TR-D-77-003",
    "province_name": "Yalova",
    "district_name": "Çiftlikköy",
    "name": "Yeni",
    "name_ascii": "yeni",
    "slug": "yeni-mahalle-ciftlikkoy-yalova-0008",
    "source": "e-icisleri-mulki-idare-bolumleri",
    "source_file": "Mahalle_Listesi.xls",
    "source_row": 31867
  }
]
