[
  {
    "id": "TR-Y-70-002-K-0001",
    "level": "yerlesim",
    "type": "koy",
    "parent_id": "TR-D-70-002",
    "province_id": "TR-P-70",
    "district_id": "TR-D-70-002",
    "province_name": "Karaman",
    "district_name": "Başyayla",
    "name": "Bozyaka",
    "name_ascii": "bozyaka",
    "slug": "bozyaka-koy-basyayla-karaman-0001",
    "source": "e-icisleri-mulki-idare-bolumleri",
    "source_file": "Koy_Listesi.xls",
    "source_row": 19177
  },
  {
    "id": "TR-Y-70-002-K-0002",
    "level": "yerlesim",
    "type": "koy",
    "parent_id": "TR-D-70-002",
    "province_id": "TR-P-70",
    "district_id": "TR-D-70-002",
    "province_name": "Karaman",
    "district_name": "Başyayla",
    "name": "Büyükkarapınar",
    "name_ascii": "buyukkarapinar",
    "slug": "buyukkarapinar-koy-basyayla-karaman-0002",
    "source": "e-icisleri-mulki-idare-bolumleri",
    "source_file": "Koy_Listesi.xls",
    "source_row": 19179
  },
  {
    "id": "TR-Y-70-002-K-0003",
    "level": "yerlesim",
    "type": "koy",
    "parent_id": "TR-D-70-002",
    "province_id": "TR-P-70",
    "district_id": "TR-D-70-002",
    "province_name": "Karaman",
    "district_name": "Başyayla",
    "name": "Kışlaköy",
    "name_ascii": "kislakoy",
    "slug": "kislakoy-koy-basyayla-karaman-0003",
    "source": "e-icisleri-mulki-idare-bolumleri",
    "source_file": "Koy_Listesi.xls",
    "source_row": 19181
  },
  {
    "id": "TR-Y-70-002-K-0004",
    "level": "yerlesim",
    "type": "koy",
    "parent_id": "TR-D-70-002",
    "province_id": "TR-P-70",
    "district_id": "TR-D-70-002",
    "province_name": "Karaman",
    "district_name": "Başyayla",
    "name": "Üzümlü",
    "name_ascii": "uzumlu",
    "slug": "uzumlu-koy-basyayla-karaman-0004",
    "source": "e-icisleri-mulki-idare-bolumleri",
    "source_file": "Koy_Listesi.xls",
    "source_row": 19183
  },
  {
    "id": "TR-Y-70-002-M-0001",
    "level": "yerlesim",
    "type": "mahalle",
    "parent_id": "TR-D-70-002",
    "province_id": "TR-P-70",
    "district_id": "TR-D-70-002",
    "province_name": "Karaman",
    "district_name": "Başyayla",
    "name": "Başköy",
    "name_ascii": "baskoy",
    "slug": "baskoy-mahalle-basyayla-karaman-0001",
    "source": "e-icisleri-mulki-idare-bolumleri",
    "source_file": "Mahalle_Listesi.xls",
    "source_row": 17092
  },
  {
    "id": "TR-Y-70-002-M-0002",
    "level": "yerlesim",
    "type": "mahalle",
    "parent_id": "TR-D-70-002",
    "province_id": "TR-P-70",
    "district_id": "TR-D-70-002",
    "province_name": "Karaman",
    "district_name": "Başyayla",
    "name": "Göztepe",
    "name_ascii": "goztepe",
    "slug": "goztepe-mahalle-basyayla-karaman-0002",
    "source": "e-icisleri-mulki-idare-bolumleri",
    "source_file": "Mahalle_Listesi.xls",
    "source_row": 17095
  },
  {
    "id": "TR-Y-70-002-M-0003",
    "level": "yerlesim",
    "type": "mahalle",
    "parent_id": "TR-D-70-002",
    "province_id": "TR-P-70",
    "district_id": "TR-D-70-002",
    "province_name": "Karaman",
    "district_name": "Başyayla",
    "name": "Kirazlıyayla",
    "name_ascii": "kirazliyayla",
    "slug": "kirazliyayla-mahalle-basyayla-karaman-0003",
    "source": "e-icisleri-mulki-idare-bolumleri",
    "source_file": "Mahalle_Listesi.xls",
    "source_row": 17094
  },
  {
    "id": "TR-Y-70-002-M-0004",
    "level": "yerlesim",
    "type": "mahalle",
    "parent_id": "TR-D-70-002",
    "province_id": "TR-P-70",
    "district_id": "TR-D-70-002",
    "province_name": "Karaman",
    "district_name": "Başyayla",
    "name": "Şirindere",
    "name_ascii": "sirindere",
    "slug": "sirindere-mahalle-basyayla-karaman-0004",
    "source": "e-icisleri-mulki-idare-bolumleri",
    "source_file": "Mahalle_Listesi.xls",
    "source_row": 17096
  },
  {
    "id": "TR-Y-70-002-M-0005",
    "level": "yerlesim",
    "type": "mahalle",
    "parent_id": "TR-D-70-002",
    "province_id": "TR-P-70",
    "district_id": "TR-D-70-002",
    "province_name": "Karaman",
    "district_name": "Başyayla",
    "name": "Yeni",
    "name_ascii": "yeni",
    "slug": "yeni-mahalle-basyayla-karaman-0005",
    "source": "e-icisleri-mulki-idare-bolumleri",
    "source_file": "Mahalle_Listesi.xls",
    "source_row": 17093
  }
]
