[
  {
    "id": "TR-Y-33-003-M-0001",
    "level": "yerlesim",
    "type": "mahalle",
    "parent_id": "TR-D-33-003",
    "province_id": "TR-P-33",
    "district_id": "TR-D-33-003",
    "province_name": "Mersin",
    "district_name": "Aydıncık",
    "name": "Atatürk",
    "name_ascii": "ataturk",
    "slug": "ataturk-mahalle-aydincik-mersin-0001",
    "source": "e-icisleri-mulki-idare-bolumleri",
    "source_file": "Mahalle_Listesi.xls",
    "source_row": 23009
  },
  {
    "id": "TR-Y-33-003-M-0002",
    "level": "yerlesim",
    "type": "mahalle",
    "parent_id": "TR-D-33-003",
    "province_id": "TR-P-33",
    "district_id": "TR-D-33-003",
    "province_name": "Mersin",
    "district_name": "Aydıncık",
    "name": "Cumhuriyet",
    "name_ascii": "cumhuriyet",
    "slug": "cumhuriyet-mahalle-aydincik-mersin-0002",
    "source": "e-icisleri-mulki-idare-bolumleri",
    "source_file": "Mahalle_Listesi.xls",
    "source_row": 23011
  },
  {
    "id": "TR-Y-33-003-M-0003",
    "level": "yerlesim",
    "type": "mahalle",
    "parent_id": "TR-D-33-003",
    "province_id": "TR-P-33",
    "district_id": "TR-D-33-003",
    "province_name": "Mersin",
    "district_name": "Aydıncık",
    "name": "Duruhan",
    "name_ascii": "duruhan",
    "slug": "duruhan-mahalle-aydincik-mersin-0003",
    "source": "e-icisleri-mulki-idare-bolumleri",
    "source_file": "Mahalle_Listesi.xls",
    "source_row": 22999
  },
  {
    "id": "TR-Y-33-003-M-0004",
    "level": "yerlesim",
    "type": "mahalle",
    "parent_id": "TR-D-33-003",
    "province_id": "TR-P-33",
    "district_id": "TR-D-33-003",
    "province_name": "Mersin",
    "district_name": "Aydıncık",
    "name": "Eskiyürük",
    "name_ascii": "eskiyuruk",
    "slug": "eskiyuruk-mahalle-aydincik-mersin-0004",
    "source": "e-icisleri-mulki-idare-bolumleri",
    "source_file": "Mahalle_Listesi.xls",
    "source_row": 23000
  },
  {
    "id": "TR-Y-33-003-M-0005",
    "level": "yerlesim",
    "type": "mahalle",
    "parent_id": "TR-D-33-003",
    "province_id": "TR-P-33",
    "district_id": "TR-D-33-003",
    "province_name": "Mersin",
    "district_name": "Aydıncık",
    "name": "Hacıbahattin",
    "name_ascii": "hacibahattin",
    "slug": "hacibahattin-mahalle-aydincik-mersin-0005",
    "source": "e-icisleri-mulki-idare-bolumleri",
    "source_file": "Mahalle_Listesi.xls",
    "source_row": 23001
  },
  {
    "id": "TR-Y-33-003-M-0006",
    "level": "yerlesim",
    "type": "mahalle",
    "parent_id": "TR-D-33-003",
    "province_id": "TR-P-33",
    "district_id": "TR-D-33-003",
    "province_name": "Mersin",
    "district_name": "Aydıncık",
    "name": "Hürriyet",
    "name_ascii": "hurriyet",
    "slug": "hurriyet-mahalle-aydincik-mersin-0006",
    "source": "e-icisleri-mulki-idare-bolumleri",
    "source_file": "Mahalle_Listesi.xls",
    "source_row": 23012
  },
  {
    "id": "TR-Y-33-003-M-0007",
    "level": "yerlesim",
    "type": "mahalle",
    "parent_id": "TR-D-33-003",
    "province_id": "TR-P-33",
    "district_id": "TR-D-33-003",
    "province_name": "Mersin",
    "district_name": "Aydıncık",
    "name": "Karadere",
    "name_ascii": "karadere",
    "slug": "karadere-mahalle-aydincik-mersin-0007",
    "source": "e-icisleri-mulki-idare-bolumleri",
    "source_file": "Mahalle_Listesi.xls",
    "source_row": 23002
  },
  {
    "id": "TR-Y-33-003-M-0008",
    "level": "yerlesim",
    "type": "mahalle",
    "parent_id": "TR-D-33-003",
    "province_id": "TR-P-33",
    "district_id": "TR-D-33-003",
    "province_name": "Mersin",
    "district_name": "Aydıncık",
    "name": "Karaseki",
    "name_ascii": "karaseki",
    "slug": "karaseki-mahalle-aydincik-mersin-0008",
    "source": "e-icisleri-mulki-idare-bolumleri",
    "source_file": "Mahalle_Listesi.xls",
    "source_row": 23003
  },
  {
    "id": "TR-Y-33-003-M-0009",
    "level": "yerlesim",
    "type": "mahalle",
    "parent_id": "TR-D-33-003",
    "province_id": "TR-P-33",
    "district_id": "TR-D-33-003",
    "province_name": "Mersin",
    "district_name": "Aydıncık",
    "name": "Merkez",
    "name_ascii": "merkez",
    "slug": "merkez-mahalle-aydincik-mersin-0009",
    "source": "e-icisleri-mulki-idare-bolumleri",
    "source_file": "Mahalle_Listesi.xls",
    "source_row": 23010
  },
  {
    "id": "TR-Y-33-003-M-0010",
    "level": "yerlesim",
    "type": "mahalle",
    "parent_id": "TR-D-33-003",
    "province_id": "TR-P-33",
    "district_id": "TR-D-33-003",
    "province_name": "Mersin",
    "district_name": "Aydıncık",
    "name": "Pembecik",
    "name_ascii": "pembecik",
    "slug": "pembecik-mahalle-aydincik-mersin-0010",
    "source": "e-icisleri-mulki-idare-bolumleri",
    "source_file": "Mahalle_Listesi.xls",
    "source_row": 23004
  },
  {
    "id": "TR-Y-33-003-M-0011",
    "level": "yerlesim",
    "type": "mahalle",
    "parent_id": "TR-D-33-003",
    "province_id": "TR-P-33",
    "district_id": "TR-D-33-003",
    "province_name": "Mersin",
    "district_name": "Aydıncık",
    "name": "Teknecik",
    "name_ascii": "teknecik",
    "slug": "teknecik-mahalle-aydincik-mersin-0011",
    "source": "e-icisleri-mulki-idare-bolumleri",
    "source_file": "Mahalle_Listesi.xls",
    "source_row": 23005
  },
  {
    "id": "TR-Y-33-003-M-0012",
    "level": "yerlesim",
    "type": "mahalle",
    "parent_id": "TR-D-33-003",
    "province_id": "TR-P-33",
    "district_id": "TR-D-33-003",
    "province_name": "Mersin",
    "district_name": "Aydıncık",
    "name": "Yeni",
    "name_ascii": "yeni",
    "slug": "yeni-mahalle-aydincik-mersin-0012",
    "source": "e-icisleri-mulki-idare-bolumleri",
    "source_file": "Mahalle_Listesi.xls",
    "source_row": 23013
  },
  {
    "id": "TR-Y-33-003-M-0013",
    "level": "yerlesim",
    "type": "mahalle",
    "parent_id": "TR-D-33-003",
    "province_id": "TR-P-33",
    "district_id": "TR-D-33-003",
    "province_name": "Mersin",
    "district_name": "Aydıncık",
    "name": "Yenikaş",
    "name_ascii": "yenikas",
    "slug": "yenikas-mahalle-aydincik-mersin-0013",
    "source": "e-icisleri-mulki-idare-bolumleri",
    "source_file": "Mahalle_Listesi.xls",
    "source_row": 23006
  },
  {
    "id": "TR-Y-33-003-M-0014",
    "level": "yerlesim",
    "type": "mahalle",
    "parent_id": "TR-D-33-003",
    "province_id": "TR-P-33",
    "district_id": "TR-D-33-003",
    "province_name": "Mersin",
    "district_name": "Aydıncık",
    "name": "Yeniyürük",
    "name_ascii": "yeniyuruk",
    "slug": "yeniyuruk-mahalle-aydincik-mersin-0014",
    "source": "e-icisleri-mulki-idare-bolumleri",
    "source_file": "Mahalle_Listesi.xls",
    "source_row": 23007
  },
  {
    "id": "TR-Y-33-003-M-0015",
    "level": "yerlesim",
    "type": "mahalle",
    "parent_id": "TR-D-33-003",
    "province_id": "TR-P-33",
    "district_id": "TR-D-33-003",
    "province_name": "Mersin",
    "district_name": "Aydıncık",
    "name": "Yeniyürükkaş",
    "name_ascii": "yeniyurukkas",
    "slug": "yeniyurukkas-mahalle-aydincik-mersin-0015",
    "source": "e-icisleri-mulki-idare-bolumleri",
    "source_file": "Mahalle_Listesi.xls",
    "source_row": 23008
  }
]
