[
  {
    "id": "TR-Y-51-001-K-0001",
    "level": "yerlesim",
    "type": "koy",
    "parent_id": "TR-D-51-001",
    "province_id": "TR-P-51",
    "district_id": "TR-D-51-001",
    "province_name": "Niğde",
    "district_name": "Altunhisar",
    "name": "Akçaören",
    "name_ascii": "akcaoren",
    "slug": "akcaoren-koy-altunhisar-nigde-0001",
    "source": "e-icisleri-mulki-idare-bolumleri",
    "source_file": "Koy_Listesi.xls",
    "source_row": 25786
  },
  {
    "id": "TR-Y-51-001-K-0002",
    "level": "yerlesim",
    "type": "koy",
    "parent_id": "TR-D-51-001",
    "province_id": "TR-P-51",
    "district_id": "TR-D-51-001",
    "province_name": "Niğde",
    "district_name": "Altunhisar",
    "name": "Çömlekçi",
    "name_ascii": "comlekci",
    "slug": "comlekci-koy-altunhisar-nigde-0002",
    "source": "e-icisleri-mulki-idare-bolumleri",
    "source_file": "Koy_Listesi.xls",
    "source_row": 25788
  },
  {
    "id": "TR-Y-51-001-K-0003",
    "level": "yerlesim",
    "type": "koy",
    "parent_id": "TR-D-51-001",
    "province_id": "TR-P-51",
    "district_id": "TR-D-51-001",
    "province_name": "Niğde",
    "district_name": "Altunhisar",
    "name": "Ulukışla",
    "name_ascii": "ulukisla",
    "slug": "ulukisla-koy-altunhisar-nigde-0003",
    "source": "e-icisleri-mulki-idare-bolumleri",
    "source_file": "Koy_Listesi.xls",
    "source_row": 25790
  },
  {
    "id": "TR-Y-51-001-K-0004",
    "level": "yerlesim",
    "type": "koy",
    "parent_id": "TR-D-51-001",
    "province_id": "TR-P-51",
    "district_id": "TR-D-51-001",
    "province_name": "Niğde",
    "district_name": "Altunhisar",
    "name": "Uluören",
    "name_ascii": "uluoren",
    "slug": "uluoren-koy-altunhisar-nigde-0004",
    "source": "e-icisleri-mulki-idare-bolumleri",
    "source_file": "Koy_Listesi.xls",
    "source_row": 25792
  },
  {
    "id": "TR-Y-51-001-K-0005",
    "level": "yerlesim",
    "type": "koy",
    "parent_id": "TR-D-51-001",
    "province_id": "TR-P-51",
    "district_id": "TR-D-51-001",
    "province_name": "Niğde",
    "district_name": "Altunhisar",
    "name": "Yakacık",
    "name_ascii": "yakacik",
    "slug": "yakacik-koy-altunhisar-nigde-0005",
    "source": "e-icisleri-mulki-idare-bolumleri",
    "source_file": "Koy_Listesi.xls",
    "source_row": 25794
  },
  {
    "id": "TR-Y-51-001-K-0006",
    "level": "yerlesim",
    "type": "koy",
    "parent_id": "TR-D-51-001",
    "province_id": "TR-P-51",
    "district_id": "TR-D-51-001",
    "province_name": "Niğde",
    "district_name": "Altunhisar",
    "name": "Yeşilyurt",
    "name_ascii": "yesilyurt",
    "slug": "yesilyurt-koy-altunhisar-nigde-0006",
    "source": "e-icisleri-mulki-idare-bolumleri",
    "source_file": "Koy_Listesi.xls",
    "source_row": 25796
  },
  {
    "id": "TR-Y-51-001-M-0001",
    "level": "yerlesim",
    "type": "mahalle",
    "parent_id": "TR-D-51-001",
    "province_id": "TR-P-51",
    "district_id": "TR-D-51-001",
    "province_name": "Niğde",
    "district_name": "Altunhisar",
    "name": "Aşağı",
    "name_ascii": "asagi",
    "slug": "asagi-mahalle-altunhisar-nigde-0001",
    "source": "e-icisleri-mulki-idare-bolumleri",
    "source_file": "Mahalle_Listesi.xls",
    "source_row": 24506
  },
  {
    "id": "TR-Y-51-001-M-0002",
    "level": "yerlesim",
    "type": "mahalle",
    "parent_id": "TR-D-51-001",
    "province_id": "TR-P-51",
    "district_id": "TR-D-51-001",
    "province_name": "Niğde",
    "district_name": "Altunhisar",
    "name": "Cumhuriyet",
    "name_ascii": "cumhuriyet",
    "slug": "cumhuriyet-mahalle-altunhisar-nigde-0002",
    "source": "e-icisleri-mulki-idare-bolumleri",
    "source_file": "Mahalle_Listesi.xls",
    "source_row": 24511
  },
  {
    "id": "TR-Y-51-001-M-0003",
    "level": "yerlesim",
    "type": "mahalle",
    "parent_id": "TR-D-51-001",
    "province_id": "TR-P-51",
    "district_id": "TR-D-51-001",
    "province_name": "Niğde",
    "district_name": "Altunhisar",
    "name": "Cumhuriyet",
    "name_ascii": "cumhuriyet",
    "slug": "cumhuriyet-mahalle-altunhisar-nigde-0003",
    "source": "e-icisleri-mulki-idare-bolumleri",
    "source_file": "Mahalle_Listesi.xls",
    "source_row": 24514
  },
  {
    "id": "TR-Y-51-001-M-0004",
    "level": "yerlesim",
    "type": "mahalle",
    "parent_id": "TR-D-51-001",
    "province_id": "TR-P-51",
    "district_id": "TR-D-51-001",
    "province_name": "Niğde",
    "district_name": "Altunhisar",
    "name": "Erenler",
    "name_ascii": "erenler",
    "slug": "erenler-mahalle-altunhisar-nigde-0004",
    "source": "e-icisleri-mulki-idare-bolumleri",
    "source_file": "Mahalle_Listesi.xls",
    "source_row": 24515
  },
  {
    "id": "TR-Y-51-001-M-0005",
    "level": "yerlesim",
    "type": "mahalle",
    "parent_id": "TR-D-51-001",
    "province_id": "TR-P-51",
    "district_id": "TR-D-51-001",
    "province_name": "Niğde",
    "district_name": "Altunhisar",
    "name": "İstiklal",
    "name_ascii": "istiklal",
    "slug": "istiklal-mahalle-altunhisar-nigde-0005",
    "source": "e-icisleri-mulki-idare-bolumleri",
    "source_file": "Mahalle_Listesi.xls",
    "source_row": 24510
  },
  {
    "id": "TR-Y-51-001-M-0006",
    "level": "yerlesim",
    "type": "mahalle",
    "parent_id": "TR-D-51-001",
    "province_id": "TR-P-51",
    "district_id": "TR-D-51-001",
    "province_name": "Niğde",
    "district_name": "Altunhisar",
    "name": "Orta",
    "name_ascii": "orta",
    "slug": "orta-mahalle-altunhisar-nigde-0006",
    "source": "e-icisleri-mulki-idare-bolumleri",
    "source_file": "Mahalle_Listesi.xls",
    "source_row": 24507
  },
  {
    "id": "TR-Y-51-001-M-0007",
    "level": "yerlesim",
    "type": "mahalle",
    "parent_id": "TR-D-51-001",
    "province_id": "TR-P-51",
    "district_id": "TR-D-51-001",
    "province_name": "Niğde",
    "district_name": "Altunhisar",
    "name": "Sağlık",
    "name_ascii": "saglik",
    "slug": "saglik-mahalle-altunhisar-nigde-0007",
    "source": "e-icisleri-mulki-idare-bolumleri",
    "source_file": "Mahalle_Listesi.xls",
    "source_row": 24509
  },
  {
    "id": "TR-Y-51-001-M-0008",
    "level": "yerlesim",
    "type": "mahalle",
    "parent_id": "TR-D-51-001",
    "province_id": "TR-P-51",
    "district_id": "TR-D-51-001",
    "province_name": "Niğde",
    "district_name": "Altunhisar",
    "name": "Selçuk",
    "name_ascii": "selcuk",
    "slug": "selcuk-mahalle-altunhisar-nigde-0008",
    "source": "e-icisleri-mulki-idare-bolumleri",
    "source_file": "Mahalle_Listesi.xls",
    "source_row": 24516
  },
  {
    "id": "TR-Y-51-001-M-0009",
    "level": "yerlesim",
    "type": "mahalle",
    "parent_id": "TR-D-51-001",
    "province_id": "TR-P-51",
    "district_id": "TR-D-51-001",
    "province_name": "Niğde",
    "district_name": "Altunhisar",
    "name": "Yaka",
    "name_ascii": "yaka",
    "slug": "yaka-mahalle-altunhisar-nigde-0009",
    "source": "e-icisleri-mulki-idare-bolumleri",
    "source_file": "Mahalle_Listesi.xls",
    "source_row": 24512
  },
  {
    "id": "TR-Y-51-001-M-0010",
    "level": "yerlesim",
    "type": "mahalle",
    "parent_id": "TR-D-51-001",
    "province_id": "TR-P-51",
    "district_id": "TR-D-51-001",
    "province_name": "Niğde",
    "district_name": "Altunhisar",
    "name": "Yeni",
    "name_ascii": "yeni",
    "slug": "yeni-mahalle-altunhisar-nigde-0010",
    "source": "e-icisleri-mulki-idare-bolumleri",
    "source_file": "Mahalle_Listesi.xls",
    "source_row": 24513
  },
  {
    "id": "TR-Y-51-001-M-0011",
    "level": "yerlesim",
    "type": "mahalle",
    "parent_id": "TR-D-51-001",
    "province_id": "TR-P-51",
    "district_id": "TR-D-51-001",
    "province_name": "Niğde",
    "district_name": "Altunhisar",
    "name": "Yukarı",
    "name_ascii": "yukari",
    "slug": "yukari-mahalle-altunhisar-nigde-0011",
    "source": "e-icisleri-mulki-idare-bolumleri",
    "source_file": "Mahalle_Listesi.xls",
    "source_row": 24508
  }
]
